No.     Time           Source                Destination           Protocol Length Info
		65 3.218957       ::1                   ::1                   HTTP/XML 498    POST /testlink2/lib/api/xmlrpc/v1/xmlrpc.php HTTP/1.0

		Frame 65: 498 bytes on wire (3984 bits), 498 bytes captured (3984 bits) on interface 0
		Null/Loopback
		Internet Protocol Version 6, Src: ::1, Dst: ::1
		Transmission Control Protocol, Src Port: 62775, Dst Port: 80, Seq: 1, Ack: 1, Len: 422
		Hypertext Transfer Protocol
		eXtensible Markup Language
		<?xml
<methodCall>
	<methodName>
		tl.getProjects
	</methodName>
	<params>
		<param>
			<value>
				<struct>
					<member>
						<name>
							devKey
						</name>
						<value>
							<string>
								e0796f1921cd5ac7d5775cfb3388d7ed
							</string>
						</value>
					</member>
				</struct>
			</value>
		</param>
	</params>
</methodCall>

		No.     Time           Source                Destination           Protocol Length Info
		134 3.417072       ::1                   ::1                   HTTP/XML 8253   HTTP/1.1 200 OK

		Frame 134: 8253 bytes on wire (66024 bits), 8253 bytes captured (66024 bits) on interface 0
		Null/Loopback
		Internet Protocol Version 6, Src: ::1, Dst: ::1
		Transmission Control Protocol, Src Port: 80, Dst Port: 62775, Seq: 1, Ack: 423, Len: 8177
		Hypertext Transfer Protocol
		eXtensible Markup Language
		<?xml
<methodResponse>
<params>
	<param>
		<value>
			<array>
				<data>
					<value>
						<struct>
							<member>
								<name>
									id
								</name>
								<value>
									<string>
										354
									</string>
								</value>
							</member>
							<member>
								<name>
									notes
								</name>
								<value>
									<string>
										&lt;p&gt;\r\n\tTest project for coffemaker&lt;/p&gt;
									</string>
								</value>
							</member>
							<member>
								<name>
									color
								</name>
								<value>
									<string>
									</string>
								</value>
							</member>
							<member>
								<name>
									active
								</name>
								<value>
									<string>
										1
									</string>
								</value>
							</member>
							<member>
								<name>
									option_reqs
								</name>
								<value>
									<string>
										0
									</string>
								</value>
							</member>
							<member>
								<name>
									option_priority
								</name>
								<value>
									<string>
										0
									</string>
								</value>
							</member>
							<member>
								<name>
									option_automation
								</name>
								<value>
									<string>
										0
									</string>
								</value>
							</member>
							<member>
								<name>
									options
								</name>
								<value>
									<string>
										O:8:&quot;stdClass&quot;:4:{s:19:&quot;requirementsEnabled&quot;;i:1;s:19:&quot;testPriorityEnabled&quot;;i:1;s:17:&quot;automationEnabled&quot;;i:1;s:16:&quot;inventoryEnabled&quot;;i:1;}
									</string>
								</value>
							</member>
							<member>
								<name>
									prefix
								</name>
								<value>
									<string>
										CFM
									</string>
								</value>
							</member>
							<member>
								<name>
									tc_counter
								</name>
								<value>
									<string>
										18
									</string>
								</value>
							</member>
							<member>
								<name>
									is_public
								</name>
								<value>
									<string>
										1
									</string>
								</value>
							</member>
							<member>
								<name>
									issue_tracker_enabled
								</name>
								<value>
									<string>
										0
									</string>
								</value>
							</member>
							<member>
								<name>
									reqmgr_integration_enabled
								</name>
								<value>
									<string>
										0
									</string>
								</value>
							</member>
							<member>
								<name>
									api_key
								</name>
								<value>
									<string>
										956b1eb8d05672a18fef2012b622f53003f0856dcd5846400eb7d38dee5113aa
									</string>
								</value>
							</member>
							<member>
								<name>
									name
								</name>
								<value>
									<string>
										Coffemaker
									</string>
								</value>
							</member>
							<member>
								<name>
									opt
								</name>
								<value>
									<struct>
										<member>
											<name>
												requirementsEnabled
											</name>
											<value>
												<int>
													1
												</int>
											</value>
										</member>
										<member>
											<name>
												testPriorityEnabled
											</name>
											<value>
												<int>
													1
												</int>
											</value>
										</member>
										<member>
											<name>
												automationEnabled
											</name>
											<value>
												<int>
													1
												</int>
											</value>
										</member>
										<member>
											<name>
												inventoryEnabled
											</name>
											<value>
												<int>
													1
												</int>
											</value>
										</member>
									</struct>
								</value>
							</member>
						</struct>
					</value>
					<value>
						<struct>
							<member>
								<name>
									id
								</name>
								<value>
									<string>
										391
									</string>
								</value>
							</member>
							<member>
								<name>
									notes
								</name>
								<value>
									<string>
										New testing project
									</string>
								</value>
							</member>
							<member>
								<name>
									color
								</name>
								<value>
									<string>
									</string>
								</value>
							</member>
							<member>
								<name>
									active
								</name>
								<value>
									<string>
										1
									</string>
								</value>
							</member>
							<member>
								<name>
									option_reqs
								</name>
								<value>
									<string>
										0
									</string>
								</value>
							</member>
							<member>
								<name>
									option_priority
								</name>
								<value>
									<string>
										0
									</string>
								</value>
							</member>
							<member>
								<name>
									option_automation
								</name>
								<value>
									<string>
										0
									</string>
								</value>
							</member>
							<member>
								<name>
									options
								</name>
								<value>
									<string>
										O:8:&quot;stdClass&quot;:4:{s:19:&quot;requirementsEnabled&quot;;i:1;s:19:&quot;testPriorityEnabled&quot;;i:1;s:17:&quot;automationEnabled&quot;;i:1;s:16:&quot;inventoryEnabled&quot;;i:0;}
									</string>
								</value>
							</member>
							<member>
								<name>
									prefix
								</name>
								<value>
									<string>
										NTP
									</string>
								</value>
							</member>
							<member>
								<name>
									tc_counter
								</name>
								<value>
									<string>
										0
									</string>
								</value>
							</member>
							<member>
								<name>
									is_public
								</name>
								<value>
									<string>
										1
									</string>
								</value>
							</member>
							<member>
								<name>
									issue_tracker_enabled
								</name>
								<value>
									<string>
										0
									</string>
								</value>
							</member>
							<member>
								<name>
									reqmgr_integration_enabled
								</name>
								<value>
									<string>
										0
									</string>
								</value>
							</member>
							<member>
								<name>
									api_key
								</name>
								<value>
									<string>
										06fa32f07717e86385e3c09b448a295ebf9ee7e0d8320414a7c236866593c166
									</string>
								</value>
							</member>
							<member>
								<name>
									name
								</name>
								<value>
									<string>
										New test project
									</string>
								</value>
							</member>
							<member>
								<name>
									opt
								</name>
								<value>
									<struct>
										<member>
											<name>
												requirementsEnabled
											</name>
											<value>
												<int>
													1
												</int>
											</value>
										</member>
										<member>
											<name>
												testPriorityEnabled
											</name>
											<value>
												<int>
													1
												</int>
											</value>
										</member>
										<member>
											<name>
												automationEnabled
											</name>
											<value>
												<int>
													1
												</int>
											</value>
										</member>
										<member>
											<name>
												inventoryEnabled
											</name>
											<value>
												<int>
													0
												</int>
											</value>
										</member>
									</struct>
								</value>
							</member>
						</struct>
					</value>
					<value>
						<struct>
							<member>
								<name>
									id
								</name>
								<value>
									<string>
										392
									</string>
								</value>
							</member>
							<member>
								<name>
									notes
								</name>
								<value>
									<string>
										New testing project
									</string>
								</value>
							</member>
							<member>
								<name>
									color
								</name>
								<value>
									<string>
									</string>
								</value>
							</member>
							<member>
								<name>
									active
								</name>
								<value>
									<string>
										1
									</string>
								</value>
							</member>
							<member>
								<name>
									option_reqs
								</name>
								<value>
									<string>
										0
									</string>
								</value>
							</member>
							<member>
								<name>
									option_priority
								</name>
								<value>
									<string>
										0
									</string>
								</value>
							</member>
							<member>
								<name>
									option_automation
								</name>
								<value>
									<string>
										0
									</string>
								</value>
							</member>
							<member>
								<name>
									options
								</name>
								<value>
									<string>
										O:8:&quot;stdClass&quot;:4:{s:19:&quot;requirementsEnabled&quot;;i:1;s:19:&quot;testPriorityEnabled&quot;;i:1;s:17:&quot;automationEnabled&quot;;i:1;s:16:&quot;inventoryEnabled&quot;;i:0;}
									</string>
								</value>
							</member>
							<member>
								<name>
									prefix
								</name>
								<value>
									<string>
										NTPA
									</string>
								</value>
							</member>
							<member>
								<name>
									tc_counter
								</name>
								<value>
									<string>
										0
									</string>
								</value>
							</member>
							<member>
								<name>
									is_public
								</name>
								<value>
									<string>
										1
									</string>
								</value>
							</member>
							<member>
								<name>
									issue_tracker_enabled
								</name>
								<value>
									<string>
										0
									</string>
								</value>
							</member>
							<member>
								<name>
									reqmgr_integration_enabled
								</name>
								<value>
									<string>
										0
									</string>
								</value>
							</member>
							<member>
								<name>
									api_key
								</name>
								<value>
									<string>
										c4e9933b396647f27355b25da99bbb497928dd4c1cd535f9cd110ad8bf30906e
									</string>
								</value>
							</member>
							<member>
								<name>
									name
								</name>
								<value>
									<string>
										New test project A
									</string>
								</value>
							</member>
							<member>
								<name>
									opt
								</name>
								<value>
									<struct>
										<member>
											<name>
												requirementsEnabled
											</name>
											<value>
												<int>
													1
												</int>
											</value>
										</member>
										<member>
											<name>
												testPriorityEnabled
											</name>
											<value>
												<int>
													1
												</int>
											</value>
										</member>
										<member>
											<name>
												automationEnabled
											</name>
											<value>
												<int>
													1
												</int>
											</value>
										</member>
										<member>
											<name>
												inventoryEnabled
											</name>
											<value>
												<int>
													0
												</int>
											</value>
										</member>
									</struct>
								</value>
							</member>
						</struct>
					</value>
					<value>
						<struct>
							<member>
								<name>
									id
								</name>
								<value>
									<string>
										1
									</string>
								</value>
							</member>
							<member>
								<name>
									notes
								</name>
								<value>
									<string>
										&lt;p&gt;\r\n\tProject for testing purpose.&amp;nbsp;&lt;/p&gt;
									</string>
								</value>
							</member>
							<member>
								<name>
									color
								</name>
								<value>
									<string>
									</string>
								</value>
							</member>
							<member>
								<name>
									active
								</name>
								<value>
									<string>
										1
									</string>
								</value>
							</member>
							<member>
								<name>
									option_reqs
								</name>
								<value>
									<string>
										0
									</string>
								</value>
							</member>
							<member>
								<name>
									option_priority
								</name>
								<value>
									<string>
										0
									</string>
								</value>
							</member>
							<member>
								<name>
									option_automation
								</name>
								<value>
									<string>
										0
									</string>
								</value>
							</member>
							<member>
								<name>
									options
								</name>
								<value>
									<string>
										O:8:&quot;stdClass&quot;:4:{s:19:&quot;requirementsEnabled&quot;;i:1;s:19:&quot;testPriorityEnabled&quot;;i:1;s:17:&quot;automationEnabled&quot;;i:1;s:16:&quot;inventoryEnabled&quot;;i:1;}
									</string>
								</value>
							</member>
							<member>
								<name>
									prefix
								</name>
								<value>
									<string>
										TEP
									</string>
								</value>
							</member>
							<member>
								<name>
									tc_counter
								</name>
								<value>
									<string>
										96
									</string>
								</value>
							</member>
							<member>
								<name>
									is_public
								</name>
								<value>
									<string>
										1
									</string>
								</value>
							</member>
							<member>
								<name>
									issue_tracker_enabled
								</name>
								<value>
									<string>
										0
									</string>
								</value>
							</member>
							<member>
								<name>
									reqmgr_integration_enabled
								</name>
								<value>
									<string>
										0
									</string>
								</value>
							</member>
							<member>
								<name>
									api_key
								</name>
								<value>
									<string>
										e7634bf33e0e5d6eb48e999798e0a892033958582b26660fdf536e56ec7d58ff
									</string>
								</value>
							</member>
							<member>
								<name>
									name
								</name>
								<value>
									<string>
										Testing project
									</string>
								</value>
							</member>
							<member>
								<name>
									opt
								</name>
								<value>
									<struct>
										<member>
											<name>
												requirementsEnabled
											</name>
											<value>
												<int>
													1
												</int>
											</value>
										</member>
										<member>
											<name>
												testPriorityEnabled
											</name>
											<value>
												<int>
													1
												</int>
											</value>
										</member>
										<member>
											<name>
												automationEnabled
											</name>
											<value>
												<int>
													1
												</int>
											</value>
										</member>
										<member>
											<name>
												inventoryEnabled
											</name>
											<value>
												<int>
													1
												</int>
											</value>
										</member>
									</struct>
								</value>
							</member>
						</struct>
					</value>
				</data>
			</array>
		</value>
	</param>
</params>
</methodResponse>

		No.     Time           Source                Destination           Protocol Length Info
		147 3.423084       ::1                   ::1                   HTTP/XML 585    POST /testlink2/lib/api/xmlrpc/v1/xmlrpc.php HTTP/1.0

		Frame 147: 585 bytes on wire (4680 bits), 585 bytes captured (4680 bits) on interface 0
		Null/Loopback
		Internet Protocol Version 6, Src: ::1, Dst: ::1
		Transmission Control Protocol, Src Port: 62777, Dst Port: 80, Seq: 1, Ack: 1, Len: 509
		Hypertext Transfer Protocol
		eXtensible Markup Language
		<?xml
<methodCall>
<methodName>
	tl.getProjectTestPlans
</methodName>
<params>
	<param>
		<value>
			<struct>
				<member>
					<name>
						testprojectid
					</name>
					<value>
						<string>
							1
						</string>
					</value>
				</member>
				<member>
					<name>
						devKey
					</name>
					<value>
						<string>
							e0796f1921cd5ac7d5775cfb3388d7ed
						</string>
					</value>
				</member>
			</struct>
		</value>
	</param>
</params>
</methodCall>

		No.     Time           Source                Destination           Protocol Length Info
		220 3.635401       ::1                   ::1                   HTTP/XML 1914   HTTP/1.1 200 OK

		Frame 220: 1914 bytes on wire (15312 bits), 1914 bytes captured (15312 bits) on interface 0
		Null/Loopback
		Internet Protocol Version 6, Src: ::1, Dst: ::1
		Transmission Control Protocol, Src Port: 80, Dst Port: 62777, Seq: 1, Ack: 510, Len: 1838
		Hypertext Transfer Protocol
		eXtensible Markup Language
		<?xml
<methodResponse>
<params>
	<param>
		<value>
			<array>
				<data>
					<value>
						<struct>
							<member>
								<name>
									id
								</name>
								<value>
									<string>
										383
									</string>
								</value>
							</member>
							<member>
								<name>
									name
								</name>
								<value>
									<string>
										Basic plan
									</string>
								</value>
							</member>
							<member>
								<name>
									notes
								</name>
								<value>
									<string>
										&lt;p&gt;\r\n\tBasic test plan with some of the test cases&lt;/p&gt;
									</string>
								</value>
							</member>
							<member>
								<name>
									active
								</name>
								<value>
									<string>
										1
									</string>
								</value>
							</member>
							<member>
								<name>
									is_public
								</name>
								<value>
									<string>
										1
									</string>
								</value>
							</member>
							<member>
								<name>
									testproject_id
								</name>
								<value>
									<string>
										1
									</string>
								</value>
							</member>
						</struct>
					</value>
					<value>
						<struct>
							<member>
								<name>
									id
								</name>
								<value>
									<string>
										384
									</string>
								</value>
							</member>
							<member>
								<name>
									name
								</name>
								<value>
									<string>
										Only steps plan
									</string>
								</value>
							</member>
							<member>
								<name>
									notes
								</name>
								<value>
									<string>
										&lt;p&gt;\r\n\tPlan with only test cases with defined steps&lt;/p&gt;
									</string>
								</value>
							</member>
							<member>
								<name>
									active
								</name>
								<value>
									<string>
										1
									</string>
								</value>
							</member>
							<member>
								<name>
									is_public
								</name>
								<value>
									<string>
										1
									</string>
								</value>
							</member>
							<member>
								<name>
									testproject_id
								</name>
								<value>
									<string>
										1
									</string>
								</value>
							</member>
						</struct>
					</value>
				</data>
			</array>
		</value>
	</param>
</params>
</methodResponse>

		No.     Time           Source                Destination           Protocol Length Info
		233 3.638022       ::1                   ::1                   HTTP/XML 589    POST /testlink2/lib/api/xmlrpc/v1/xmlrpc.php HTTP/1.0

		Frame 233: 589 bytes on wire (4712 bits), 589 bytes captured (4712 bits) on interface 0
		Null/Loopback
		Internet Protocol Version 6, Src: ::1, Dst: ::1
		Transmission Control Protocol, Src Port: 62779, Dst Port: 80, Seq: 1, Ack: 1, Len: 513
		Hypertext Transfer Protocol
		eXtensible Markup Language
		<?xml
<methodCall>
<methodName>
	tl.getTestSuitesForTestPlan
</methodName>
<params>
	<param>
		<value>
			<struct>
				<member>
					<name>
						testplanid
					</name>
					<value>
						<string>
							383
						</string>
					</value>
				</member>
				<member>
					<name>
						devKey
					</name>
					<value>
						<string>
							e0796f1921cd5ac7d5775cfb3388d7ed
						</string>
					</value>
				</member>
			</struct>
		</value>
	</param>
</params>
</methodCall>

		No.     Time           Source                Destination           Protocol Length Info
		386 3.839955       ::1                   ::1                   HTTP/XML 3804   HTTP/1.1 200 OK

		Frame 386: 3804 bytes on wire (30432 bits), 3804 bytes captured (30432 bits) on interface 0
		Null/Loopback
		Internet Protocol Version 6, Src: ::1, Dst: ::1
		Transmission Control Protocol, Src Port: 80, Dst Port: 62779, Seq: 1, Ack: 514, Len: 3728
		Hypertext Transfer Protocol
		eXtensible Markup Language
		<?xml
<methodResponse>
<params>
	<param>
		<value>
			<array>
				<data>
					<value>
						<struct>
							<member>
								<name>
									name
								</name>
								<value>
									<string>
										API
									</string>
								</value>
							</member>
							<member>
								<name>
									id
								</name>
								<value>
									<string>
										2
									</string>
								</value>
							</member>
							<member>
								<name>
									parent_id
								</name>
								<value>
									<string>
										1
									</string>
								</value>
							</member>
						</struct>
					</value>
					<value>
						<struct>
							<member>
								<name>
									name
								</name>
								<value>
									<string>
										Filters
									</string>
								</value>
							</member>
							<member>
								<name>
									id
								</name>
								<value>
									<string>
										240
									</string>
								</value>
							</member>
							<member>
								<name>
									parent_id
								</name>
								<value>
									<string>
										178
									</string>
								</value>
							</member>
						</struct>
					</value>
					<value>
						<struct>
							<member>
								<name>
									name
								</name>
								<value>
									<string>
										Issue Tracker Management
									</string>
								</value>
							</member>
							<member>
								<name>
									id
								</name>
								<value>
									<string>
										15
									</string>
								</value>
							</member>
							<member>
								<name>
									parent_id
								</name>
								<value>
									<string>
										1
									</string>
								</value>
							</member>
						</struct>
					</value>
					<value>
						<struct>
							<member>
								<name>
									name
								</name>
								<value>
									<string>
										Operation New Child Test Suite
									</string>
								</value>
							</member>
							<member>
								<name>
									id
								</name>
								<value>
									<string>
										233
									</string>
								</value>
							</member>
							<member>
								<name>
									parent_id
								</name>
								<value>
									<string>
										232
									</string>
								</value>
							</member>
						</struct>
					</value>
					<value>
						<struct>
							<member>
								<name>
									name
								</name>
								<value>
									<string>
										set execution result
									</string>
								</value>
							</member>
							<member>
								<name>
									id
								</name>
								<value>
									<string>
										3
									</string>
								</value>
							</member>
							<member>
								<name>
									parent_id
								</name>
								<value>
									<string>
										2
									</string>
								</value>
							</member>
						</struct>
					</value>
					<value>
						<struct>
							<member>
								<name>
									name
								</name>
								<value>
									<string>
										Switch Filter Mode
									</string>
								</value>
							</member>
							<member>
								<name>
									id
								</name>
								<value>
									<string>
										241
									</string>
								</value>
							</member>
							<member>
								<name>
									parent_id
								</name>
								<value>
									<string>
										240
									</string>
								</value>
							</member>
						</struct>
					</value>
					<value>
						<struct>
							<member>
								<name>
									name
								</name>
								<value>
									<string>
										Test Case Management
									</string>
								</value>
							</member>
							<member>
								<name>
									id
								</name>
								<value>
									<string>
										206
									</string>
								</value>
							</member>
							<member>
								<name>
									parent_id
								</name>
								<value>
									<string>
										178
									</string>
								</value>
							</member>
						</struct>
					</value>
					<value>
						<struct>
							<member>
								<name>
									name
								</name>
								<value>
									<string>
										Test Specification
									</string>
								</value>
							</member>
							<member>
								<name>
									id
								</name>
								<value>
									<string>
										178
									</string>
								</value>
							</member>
							<member>
								<name>
									parent_id
								</name>
								<value>
									<string>
										1
									</string>
								</value>
							</member>
						</struct>
					</value>
					<value>
						<struct>
							<member>
								<name>
									name
								</name>
								<value>
									<string>
										Test Suite Management
									</string>
								</value>
							</member>
							<member>
								<name>
									id
								</name>
								<value>
									<string>
										179
									</string>
								</value>
							</member>
							<member>
								<name>
									parent_id
								</name>
								<value>
									<string>
										178
									</string>
								</value>
							</member>
						</struct>
					</value>
					<value>
						<struct>
							<member>
								<name>
									name
								</name>
								<value>
									<string>
										Test suite operations
									</string>
								</value>
							</member>
							<member>
								<name>
									id
								</name>
								<value>
									<string>
										232
									</string>
								</value>
							</member>
							<member>
								<name>
									parent_id
								</name>
								<value>
									<string>
										231
									</string>
								</value>
							</member>
						</struct>
					</value>
					<value>
						<struct>
							<member>
								<name>
									name
								</name>
								<value>
									<string>
										User control of refresh tree after each operation
									</string>
								</value>
							</member>
							<member>
								<name>
									id
								</name>
								<value>
									<string>
										231
									</string>
								</value>
							</member>
							<member>
								<name>
									parent_id
								</name>
								<value>
									<string>
										178
									</string>
								</value>
							</member>
						</struct>
					</value>
				</data>
			</array>
		</value>
	</param>
</params>
</methodResponse>

		No.     Time           Source                Destination           Protocol Length Info
		399 3.843226       ::1                   ::1                   HTTP/XML 812    POST /testlink2/lib/api/xmlrpc/v1/xmlrpc.php HTTP/1.0

		Frame 399: 812 bytes on wire (6496 bits), 812 bytes captured (6496 bits) on interface 0
		Null/Loopback
		Internet Protocol Version 6, Src: ::1, Dst: ::1
		Transmission Control Protocol, Src Port: 62781, Dst Port: 80, Seq: 1, Ack: 1, Len: 736
		Hypertext Transfer Protocol
		eXtensible Markup Language
		<?xml
<methodCall>
<methodName>
	tl.getTestCasesForTestSuite
</methodName>
<params>
	<param>
		<value>
			<struct>
				<member>
					<name>
						testsuiteid
					</name>
					<value>
						<string>
							2
						</string>
					</value>
				</member>
				<member>
					<name>
						deep
					</name>
					<value>
						<boolean>
							1
						</boolean>
					</value>
				</member>
				<member>
					<name>
						details
					</name>
					<value>
						<string>
							full
						</string>
					</value>
				</member>
				<member>
					<name>
						keywords
					</name>
					<value>
						<boolean>
							1
						</boolean>
					</value>
				</member>
				<member>
					<name>
						devKey
					</name>
					<value>
						<string>
							e0796f1921cd5ac7d5775cfb3388d7ed
						</string>
					</value>
				</member>
			</struct>
		</value>
	</param>
</params>
</methodCall>

		No.     Time           Source                Destination           Protocol Length Info
		619 4.066515       ::1                   ::1                   HTTP/XML 10988  HTTP/1.1 200 OK

		Frame 619: 10988 bytes on wire (87904 bits), 10988 bytes captured (87904 bits) on interface 0
		Null/Loopback
		Internet Protocol Version 6, Src: ::1, Dst: ::1
		Transmission Control Protocol, Src Port: 80, Dst Port: 62781, Seq: 1, Ack: 737, Len: 10912
		Hypertext Transfer Protocol
		eXtensible Markup Language
		<?xml
<methodResponse>
<params>
	<param>
		<value>
			<array>
				<data>
					<value>
						<struct>
							<member>
								<name>
									id
								</name>
								<value>
									<string>
										393
									</string>
								</value>
							</member>
							<member>
								<name>
									parent_id
								</name>
								<value>
									<string>
										2
									</string>
								</value>
							</member>
							<member>
								<name>
									node_type_id
								</name>
								<value>
									<string>
										3
									</string>
								</value>
							</member>
							<member>
								<name>
									node_order
								</name>
								<value>
									<string>
										0
									</string>
								</value>
							</member>
							<member>
								<name>
									node_table
								</name>
								<value>
									<string>
										testcases
									</string>
								</value>
							</member>
							<member>
								<name>
									name
								</name>
								<value>
									<string>
										New Test Case
									</string>
								</value>
							</member>
							<member>
								<name>
									external_id
								</name>
								<value>
									<string>
										TEP-96
									</string>
								</value>
							</member>
							<member>
								<name>
									tc_external_id
								</name>
								<value>
									<string>
										96
									</string>
								</value>
							</member>
							<member>
								<name>
									version
								</name>
								<value>
									<string>
										1
									</string>
								</value>
							</member>
							<member>
								<name>
									layout
								</name>
								<value>
									<string>
										1
									</string>
								</value>
							</member>
							<member>
								<name>
									status
								</name>
								<value>
									<string>
										1
									</string>
								</value>
							</member>
							<member>
								<name>
									summary
								</name>
								<value>
									<string>
										Summary of the test case
									</string>
								</value>
							</member>
							<member>
								<name>
									preconditions
								</name>
								<value>
									<string>
										Test case preconditions
									</string>
								</value>
							</member>
							<member>
								<name>
									importance
								</name>
								<value>
									<string>
										2
									</string>
								</value>
							</member>
							<member>
								<name>
									author_id
								</name>
								<value>
									<string>
										1
									</string>
								</value>
							</member>
							<member>
								<name>
									creation_ts
								</name>
								<value>
									<string>
										2016-12-10 01:38:37
									</string>
								</value>
							</member>
							<member>
								<name>
									updater_id
								</name>
								<value>
									<string>
									</string>
								</value>
							</member>
							<member>
								<name>
									modification_ts
								</name>
								<value>
									<string>
										2016-12-10 01:38:37
									</string>
								</value>
							</member>
							<member>
								<name>
									active
								</name>
								<value>
									<string>
										1
									</string>
								</value>
							</member>
							<member>
								<name>
									is_open
								</name>
								<value>
									<string>
										1
									</string>
								</value>
							</member>
							<member>
								<name>
									execution_type
								</name>
								<value>
									<string>
										1
									</string>
								</value>
							</member>
							<member>
								<name>
									estimated_exec_duration
								</name>
								<value>
									<string>
									</string>
								</value>
							</member>
							<member>
								<name>
									tcversion_id
								</name>
								<value>
									<string>
										394
									</string>
								</value>
							</member>
							<member>
								<name>
									steps
								</name>
								<value>
									<array>
										<data>
											<value>
												<struct>
													<member>
														<name>
															id
														</name>
														<value>
															<string>
																395
															</string>
														</value>
													</member>
													<member>
														<name>
															step_number
														</name>
														<value>
															<string>
																1
															</string>
														</value>
													</member>
													<member>
														<name>
															actions
														</name>
														<value>
															<string>
																first step
															</string>
														</value>
													</member>
													<member>
														<name>
															expected_results
														</name>
														<value>
															<string>
															</string>
														</value>
													</member>
													<member>
														<name>
															active
														</name>
														<value>
															<string>
																1
															</string>
														</value>
													</member>
													<member>
														<name>
															execution_type
														</name>
														<value>
															<string>
																1
															</string>
														</value>
													</member>
												</struct>
											</value>
											<value>
												<struct>
													<member>
														<name>
															id
														</name>
														<value>
															<string>
																397
															</string>
														</value>
													</member>
													<member>
														<name>
															step_number
														</name>
														<value>
															<string>
																1
															</string>
														</value>
													</member>
													<member>
														<name>
															actions
														</name>
														<value>
															<string>
																first step
															</string>
														</value>
													</member>
													<member>
														<name>
															expected_results
														</name>
														<value>
															<string>
															</string>
														</value>
													</member>
													<member>
														<name>
															active
														</name>
														<value>
															<string>
																1
															</string>
														</value>
													</member>
													<member>
														<name>
															execution_type
														</name>
														<value>
															<string>
																1
															</string>
														</value>
													</member>
												</struct>
											</value>
											<value>
												<struct>
													<member>
														<name>
															id
														</name>
														<value>
															<string>
																396
															</string>
														</value>
													</member>
													<member>
														<name>
															step_number
														</name>
														<value>
															<string>
																2
															</string>
														</value>
													</member>
													<member>
														<name>
															actions
														</name>
														<value>
															<string>
																second step
															</string>
														</value>
													</member>
													<member>
														<name>
															expected_results
														</name>
														<value>
															<string>
															</string>
														</value>
													</member>
													<member>
														<name>
															active
														</name>
														<value>
															<string>
																1
															</string>
														</value>
													</member>
													<member>
														<name>
															execution_type
														</name>
														<value>
															<string>
																1
															</string>
														</value>
													</member>
												</struct>
											</value>
											<value>
												<struct>
													<member>
														<name>
															id
														</name>
														<value>
															<string>
																398
															</string>
														</value>
													</member>
													<member>
														<name>
															step_number
														</name>
														<value>
															<string>
																2
															</string>
														</value>
													</member>
													<member>
														<name>
															actions
														</name>
														<value>
															<string>
																second step
															</string>
														</value>
													</member>
													<member>
														<name>
															expected_results
														</name>
														<value>
															<string>
															</string>
														</value>
													</member>
													<member>
														<name>
															active
														</name>
														<value>
															<string>
																1
															</string>
														</value>
													</member>
													<member>
														<name>
															execution_type
														</name>
														<value>
															<string>
																1
															</string>
														</value>
													</member>
												</struct>
											</value>
										</data>
									</array>
								</value>
							</member>
							<member>
								<name>
									tsuite_name
								</name>
								<value>
									<string>
										API
									</string>
								</value>
							</member>
						</struct>
					</value>
					<value>
						<struct>
							<member>
								<name>
									id
								</name>
								<value>
									<string>
										4
									</string>
								</value>
							</member>
							<member>
								<name>
									parent_id
								</name>
								<value>
									<string>
										3
									</string>
								</value>
							</member>
							<member>
								<name>
									node_type_id
								</name>
								<value>
									<string>
										3
									</string>
								</value>
							</member>
							<member>
								<name>
									node_order
								</name>
								<value>
									<string>
										100
									</string>
								</value>
							</member>
							<member>
								<name>
									node_table
								</name>
								<value>
									<string>
										testcases
									</string>
								</value>
							</member>
							<member>
								<name>
									name
								</name>
								<value>
									<string>
										set exec result - test plan WITHOUT PLATFORMS
									</string>
								</value>
							</member>
							<member>
								<name>
									external_id
								</name>
								<value>
									<string>
										TEP-1
									</string>
								</value>
							</member>
							<member>
								<name>
									tc_external_id
								</name>
								<value>
									<string>
										1
									</string>
								</value>
							</member>
							<member>
								<name>
									version
								</name>
								<value>
									<string>
										1
									</string>
								</value>
							</member>
							<member>
								<name>
									layout
								</name>
								<value>
									<string>
										1
									</string>
								</value>
							</member>
							<member>
								<name>
									status
								</name>
								<value>
									<string>
										1
									</string>
								</value>
							</member>
							<member>
								<name>
									summary
								</name>
								<value>
									<string>
									</string>
								</value>
							</member>
							<member>
								<name>
									preconditions
								</name>
								<value>
									<string>
									</string>
								</value>
							</member>
							<member>
								<name>
									importance
								</name>
								<value>
									<string>
										2
									</string>
								</value>
							</member>
							<member>
								<name>
									author_id
								</name>
								<value>
									<string>
										1
									</string>
								</value>
							</member>
							<member>
								<name>
									creation_ts
								</name>
								<value>
									<string>
										2016-11-22 16:09:44
									</string>
								</value>
							</member>
							<member>
								<name>
									updater_id
								</name>
								<value>
									<string>
										1
									</string>
								</value>
							</member>
							<member>
								<name>
									modification_ts
								</name>
								<value>
									<string>
										2016-12-07 20:18:13
									</string>
								</value>
							</member>
							<member>
								<name>
									active
								</name>
								<value>
									<string>
										1
									</string>
								</value>
							</member>
							<member>
								<name>
									is_open
								</name>
								<value>
									<string>
										1
									</string>
								</value>
							</member>
							<member>
								<name>
									execution_type
								</name>
								<value>
									<string>
										1
									</string>
								</value>
							</member>
							<member>
								<name>
									estimated_exec_duration
								</name>
								<value>
									<string>
									</string>
								</value>
							</member>
							<member>
								<name>
									tcversion_id
								</name>
								<value>
									<string>
										5
									</string>
								</value>
							</member>
							<member>
								<name>
									steps
								</name>
								<value>
									<string>
									</string>
								</value>
							</member>
							<member>
								<name>
									tsuite_name
								</name>
								<value>
									<string>
										set execution result
									</string>
								</value>
							</member>
						</struct>
					</value>
					<value>
						<struct>
							<member>
								<name>
									id
								</name>
								<value>
									<string>
										6
									</string>
								</value>
							</member>
							<member>
								<name>
									parent_id
								</name>
								<value>
									<string>
										3
									</string>
								</value>
							</member>
							<member>
								<name>
									node_type_id
								</name>
								<value>
									<string>
										3
									</string>
								</value>
							</member>
							<member>
								<name>
									node_order
								</name>
								<value>
									<string>
										101
									</string>
								</value>
							</member>
							<member>
								<name>
									node_table
								</name>
								<value>
									<string>
										testcases
									</string>
								</value>
							</member>
							<member>
								<name>
									name
								</name>
								<value>
									<string>
										set exec result - test plan WITH WRONG PLATFORM NAME
									</string>
								</value>
							</member>
							<member>
								<name>
									external_id
								</name>
								<value>
									<string>
										TEP-2
									</string>
								</value>
							</member>
							<member>
								<name>
									tc_external_id
								</name>
								<value>
									<string>
										2
									</string>
								</value>
							</member>
							<member>
								<name>
									version
								</name>
								<value>
									<string>
										1
									</string>
								</value>
							</member>
							<member>
								<name>
									layout
								</name>
								<value>
									<string>
										1
									</string>
								</value>
							</member>
							<member>
								<name>
									status
								</name>
								<value>
									<string>
										1
									</string>
								</value>
							</member>
							<member>
								<name>
									summary
								</name>
								<value>
									<string>
									</string>
								</value>
							</member>
							<member>
								<name>
									preconditions
								</name>
								<value>
									<string>
									</string>
								</value>
							</member>
							<member>
								<name>
									importance
								</name>
								<value>
									<string>
										2
									</string>
								</value>
							</member>
							<member>
								<name>
									author_id
								</name>
								<value>
									<string>
										1
									</string>
								</value>
							</member>
							<member>
								<name>
									creation_ts
								</name>
								<value>
									<string>
										2016-11-22 16:09:44
									</string>
								</value>
							</member>
							<member>
								<name>
									updater_id
								</name>
								<value>
									<string>
									</string>
								</value>
							</member>
							<member>
								<name>
									modification_ts
								</name>
								<value>
									<string>
										2016-11-22 16:09:44
									</string>
								</value>
							</member>
							<member>
								<name>
									active
								</name>
								<value>
									<string>
										1
									</string>
								</value>
							</member>
							<member>
								<name>
									is_open
								</name>
								<value>
									<string>
										1
									</string>
								</value>
							</member>
							<member>
								<name>
									execution_type
								</name>
								<value>
									<string>
										1
									</string>
								</value>
							</member>
							<member>
								<name>
									estimated_exec_duration
								</name>
								<value>
									<string>
									</string>
								</value>
							</member>
							<member>
								<name>
									tcversion_id
								</name>
								<value>
									<string>
										7
									</string>
								</value>
							</member>
							<member>
								<name>
									steps
								</name>
								<value>
									<string>
									</string>
								</value>
							</member>
							<member>
								<name>
									tsuite_name
								</name>
								<value>
									<string>
										set execution result
									</string>
								</value>
							</member>
						</struct>
					</value>
					<value>
						<struct>
							<member>
								<name>
									id
								</name>
								<value>
									<string>
										8
									</string>
								</value>
							</member>
							<member>
								<name>
									parent_id
								</name>
								<value>
									<string>
										3
									</string>
								</value>
							</member>
							<member>
								<name>
									node_type_id
								</name>
								<value>
									<string>
										3
									</string>
								</value>
							</member>
							<member>
								<name>
									node_order
								</name>
								<value>
									<string>
										102
									</string>
								</value>
							</member>
							<member>
								<name>
									node_table
								</name>
								<value>
									<string>
										testcases
									</string>
								</value>
							</member>
							<member>
								<name>
									name
								</name>
								<value>
									<string>
										set exec result - test plan WITH WRONG PLATFORM ID
									</string>
								</value>
							</member>
							<member>
								<name>
									external_id
								</name>
								<value>
									<string>
										TEP-3
									</string>
								</value>
							</member>
							<member>
								<name>
									tc_external_id
								</name>
								<value>
									<string>
										3
									</string>
								</value>
							</member>
							<member>
								<name>
									version
								</name>
								<value>
									<string>
										1
									</string>
								</value>
							</member>
							<member>
								<name>
									layout
								</name>
								<value>
									<string>
										1
									</string>
								</value>
							</member>
							<member>
								<name>
									status
								</name>
								<value>
									<string>
										1
									</string>
								</value>
							</member>
							<member>
								<name>
									summary
								</name>
								<value>
									<string>
									</string>
								</value>
							</member>
							<member>
								<name>
									preconditions
								</name>
								<value>
									<string>
									</string>
								</value>
							</member>
							<member>
								<name>
									importance
								</name>
								<value>
									<string>
										2
									</string>
								</value>
							</member>
							<member>
								<name>
									author_id
								</name>
								<value>
									<string>
										1
									</string>
								</value>
							</member>
							<member>
								<name>
									creation_ts
								</name>
								<value>
									<string>
										2016-11-22 16:09:44
									</string>
								</value>
							</member>
							<member>
								<name>
									updater_id
								</name>
								<value>
									<string>
									</string>
								</value>
							</member>
							<member>
								<name>
									modification_ts
								</name>
								<value>
									<string>
										2016-11-22 16:09:44
									</string>
								</value>
							</member>
							<member>
								<name>
									active
								</name>
								<value>
									<string>
										1
									</string>
								</value>
							</member>
							<member>
								<name>
									is_open
								</name>
								<value>
									<string>
										1
									</string>
								</value>
							</member>
							<member>
								<name>
									execution_type
								</name>
								<value>
									<string>
										1
									</string>
								</value>
							</member>
							<member>
								<name>
									estimated_exec_duration
								</name>
								<value>
									<string>
									</string>
								</value>
							</member>
							<member>
								<name>
									tcversion_id
								</name>
								<value>
									<string>
										9
									</string>
								</value>
							</member>
							<member>
								<name>
									steps
								</name>
								<value>
									<string>
									</string>
								</value>
							</member>
							<member>
								<name>
									tsuite_name
								</name>
								<value>
									<string>
										set execution result
									</string>
								</value>
							</member>
						</struct>
					</value>
				</data>
			</array>
		</value>
	</param>
</params>
</methodResponse>
